id;character;origin_dialogue;translated_dialogue
ASZA004TO;TO;I'm getting the feeling that you won't get too far with this fella until you earn the power of INVISIBILITY. You'll earn that at RANK 30. Do you still want to jump in and try?;
WWZA009TO;TO;/AButton/Jump in;
WWZA010TO;TO;/BButton/Come back later;
WWCC000RA;RA;Eh, eh-eh. Eh, eh, eheh!;
WWZF000TO;TO;Out bullet shopping.  Back in a few.;
WWBE014FR;FR;I like war! War is fun! Victory is important to me.;
WWBF019NP;NP;Huh huh! My blood runs hot with passion for battle!;